|0
"Nebula Award Nominee for Best Short Story for ""The Elizabeth Complex"""|1
New York City Book Award for Book of the Year|1
Asian/Pacific American Award for Literature for Children and Young Adult|1
BRLA|1
Harvey Awards for Best Continuing or Limited Series & Best Colorist|1
Helen and Kurt Wolff Translator's Prize Nominee for Michael Hulse|1
Deutscher Science Fiction Preis for Bester Roman|1
Prix Aujourd'hui|1
Edgar Award for Best Best Juvenile|1
Anisfield-Wolf Book Award for Nonfiction|1
Australian Natives' Literature Award|1
Commonwealth Writers' Prize Nominee for Best Book in South East Asia and Pacific|1
Prêmio Lourenço Filho|1
"Nebula Award for Best Novelette for ""Fire Watch"""|1
"Hugo Award Nominee for Best Novella for ""Forgiveness Day"""|1
Canada Council Children's Literature Award|1
RIO Award of Excellence by Reviewers International Organization for Favorite Anthology|1
Locus Award for Best Novella|1
Phantastik-Preis der Stadt Wetzlar|1
Francis Awards Triple Nominee|1
HOLT Medallion by Virginia Romance Writers for Paranormal/Time Travel/Futuristic & Best First Book|1
Best Anthology|1
Brageprisen Nominee for Fiction|1
Deutscher Jugendliteraturpreis for Kindersachbuch|1
Massachusetts Book Award for Poetry|1
Premio Nonino|1
"Asimov's Readers' Poll Award Nominee for Best Novelette for ""Taklamakan"""|1
"Hugo Award Nominee for Best Short Fiction for ""The Doors of His Face"|1
Minnesota Book Award for Young Adult Fiction|1
British Science Fiction Association Award for Best SF Novel|1
OKRWA National Readers Choice Award for Long Contemporary|1
"Hugo Award Nominee for Best Novelette for ""Mikal's Songbird"""|1
Deutscher Bücherpreis Nominee|1
OKRWA National Readers Choice Award for Regency|1
Maggie Award for Excellence|1
Booktrust Teenage Prize Shortlist|1
National Book Critics Circle Award Nominee|1
National Book Award Finalist for The Sciences|1
Weekly Reader Editor's Choice|1
"Theodore Sturgeon Memorial Award Nominee for ""Dori Bangs"""|1
Deutscher Jugendliteraturpreis for Bilderbuch|1
Christy Award for Suspense / Mystery|1
Saltire Society Literary Award for Book of the Year|1
Frank L. and Harriet C. Owsley Award|1
000 Words|1
RIO Award of Excellence by Reviewers International Organization|1
Ockham New Zealand Book Awards Nominee for 2nd|1
National Book Award for Autobiography/Biography|1
Whitbread Award for Poetry|1
Deutscher Krimi Preis for 1. Platz National|1
"Analog Award for Best Short Story for ""The Crystal Spheres"""|1
Hugo Award for Best Related Book|1
Victorian Premier's Literary Award for Children's Books|1
HOLT Medallion by Virginia Romance Writers for Short Contemporary|1
Harvey Awards Nominee for Best Continuing or Limited Series & Best Writer|1
Orange Prize Nominee for New Writers|1
Scott Moncrieff Prize for Patricia Clancy|1
Brageprisen for Fiction|1
Prix Fénéon|1
Best Biographical|1
Harvey Awards for Best Graphic Album of Original Material|1
Kuvastaja|1
"Locus Award Nominee for Best Novelette for ""Fire Watch"""|1
"Analog Award Nominee for Best Novelette for ""Mikal's Songbird"""|1
Saskatchewan Book Award|1
Jane Addams Children's Book Award Nominee for Special Recognition|1
Marten Toonder/Geertjan Lubberhuizenprijs|1
Green Mountain Book Award|1
Rivertonprisen|1
Sunshine State Young Readers Award Nominee|1
Wolfson History Prize|1
Bancroft Prize for rescind for scholarly misconduct|1
Ridenhour Book Prize|1
Weickhardt Award|1
1998)|1
IACP Cookbook Awards|1
Favorite Books by Romance Writers of America for Favorite Books of 2001|1
Schneider Family Book Award for Teen Book|1
BTBA Best Translated Book Award Nominee for Fiction Shortlist|1
Keystone to Reading Book Award for Primary|1
Henry Adams Prize|1
Gay Men's Small Press Book Award|1
Janusz A. Zajdel Award for Novel|1
John W. Campbell Memorial Award Nominee for Best Novel|1
Living Now Book Awards|1
"Retro Hugo Award Nominee for Best Novelette for ""Dead Knowledge"""|1
Golden Medallion by Romance Writers of America Nominee for Historical Romance|1
Angelus Nominee|1
Grand Prix de l'Imaginaire for Roman francophone|1
Angus Book Award|1
California Young Readers Medal Nominee for Young Adult & Middle School/Junior High|1
"World Fantasy Award for Best Short Fiction for ""Mackintosh Willy"" and Nominee for Best Anthology/Collection"|1
Vondel Prize for Stacey Knecht|1
HOLT Medallion by Virginia Romance Writers Nominee for Southern Theme|1
Desert Rose Golden Quill Award for Best Historical Romance|1
Oregon Book Award Nominee for Nonfiction|1
Affaire de Coeur Critics Choice Award Nominee|1
Government & Political Science|1
French-American Foundation Translation Prize for Non-fiction|1
Whitbread Award|1
Prix du Festival d'Angoulême for Alph-art du coup de coeur|1
PROSE Award for History|1
Sahitya Akademi Award for English|1
Golden Archer Award for Primary|1
"World Fantasy Award Nominee for Best Anthology and Best Novella for ""Seventy-Two Letters"""|1
Prijs van de Vlaamse lezer|1
IACP Cookbook Awards for Literary Food Writing|1
RITA Award by Romance Writers of America Nominee for Paranormal Romance & Best First Book|1
Premi de la Fundació d'Amics de les Arts i les Lletres de Sabadell|1
RITA Award by Romance Writers of America for Best Series Historical Romance|1
"Agatha Award for Best Short Story for ""Kim's Game"" by M.D. Lake"|1
"Sidewise Award for Best Short Form for ""Seventy-Two Letters"""|1
Marsh Award for Children's Literature in Translation|1
Grand Prix de l'Imaginaire Nominee for Nouvelle étrangère|1
F. Bordewijkprijs|1
Ohioana Book Award for Nonfiction|1
Will Eisner Comic Industry Awards for Best Short Story|1
Wisconsin Library Association Literary Award|1
Riksmålsforbundets barne- og ungdomsbokpris|1
Barry Award Nominee for Best Thriller|1
London Book Festival for Photography/Art|1
World Fantasy Award for Best Anthology|1
Gumshoe Award for Best European Crime Novel|1
San Diego Book Award Nominee for Best Western or Historical Romance|1
Prix Femina Vacaresco|1
Preis der Jugendjury|1
"Locus Award Nominee for Best Novelette for ""The Locusts"|1
Asimov's Readers' Poll Award for Best Novelette|1
Aurealis Award for Best Science Fiction Novel|1
Audie Award for Literary Fiction & Classics|1
Spur Award for Best Juvenile Nonfiction|1
PEN/Macmillan Silver Pen Award|1
Schlegel-Tieck Prize for Krishna Winston|1
Lambda Literary Award Nominee for Anthologies/Nonfiction|1
"Nebula Award Nominee for Best Novelette for ""Taklamakan"""|1
David Gemmell Legend Award for Best Fantasy Novel|1
Tennessee Young Readers Award|1
IGN Award for Best Collection|1
Pennsylvania Young Readers' Choice Award for Grades K-3|1
Lambda Literary Award Nominee for Gay Men's Mystery/Science Fiction|1
"Hugo Award Nominee for Best Short Story for ""The Edge of the World"""|1
HOLT Medallion by Virginia Romance Writers for Traditional|1
Национални фантастични награди for Най-добър превод за 2014 г. – първо място|1
National Book Critics Circle Award|1
More Than Magic Award Nominee for Historical|1
Harvey Awards for Best Graphic Album of Previously Published Work|1
Readers' Favorite Book Award for Children - Grade K-3rd|1
OKRWA National Readers Choice Award for Long Historical|1
Young Hoosier Book Award Nominee for Middle Grades|1
Lambda Literary Award Nominee for Drama|1
The Best of the Booker|1
1996|1
California Young Readers Medal for Middle School/Jr. High|1
British Science Fiction Association Award for 50th Anniversary Award Best Novel of 1958|1
"Hugo Award for Best Novelette for ""Bloodchild"""|1
Sir John A. Macdonald Prize|1
"Hugo Award for Best Novelette for ""Adrift Just Off the Islets of Langerhans: Latitude 38° 54' N"|1
Prix de la Divulgation historique|1
"Theodore Sturgeon Memorial Award Nominee for ""Congenital Agenesis of Gender Ideation"""|1
Golden Heart by Romance Writers of America Nominee for Best Regency Romance|1
"James Tiptree Jr. Award for ""Congenital Agenesis of Gender Ideation"""|1
"World Fantasy Award Nominee for Best Short Fiction for ""The Edge of the World"""|1
Bram Stoker Award for Best Anthology|1
Lambda Literary Award for Gay Men's Biography/Autobiography|1
National Book Award for First Work of Fiction|1
Anthony Award for Best Historical Mystery|1
J.R. Ackerley Prize for Autobiography|1
National Book Award for History and Biography|1
Hessell-Tiltman Prize|1
CWA Debut Dagger|1
Bruce Alexander Memorial Historical Mystery Award|1
Borders Original Voices Award for YA or Independent Reader|1
Varjo-Finlandia|1
Pura Belpré Award for Illustration|1
"Analog Award Nominee for Best Novella/Novelette for ""Rockabye Baby"""|1
The Romance Journal: Best American Historical|1
Society of Midland Authors Award Nominee for Children's Fiction|1
Children's Book Council of Australia Award Nominee for Picture Book of the Year|1
Minnesota Book Award for Novels & Short Stories|1
Frederick Jackson Turner Award|1
Glass Key Award for Best Nordic Crime Novel|1
"Theodore Sturgeon Memorial Award for ""The Edge of the World"""|1
Washington Children's Choice Picture Book Award|1
"Balrog Award Nominee for Best Short Fiction for ""An Act of Faith"" and Nominee for Best Collection/Anthology"|1
Harvey Awards Nominee for Best Writer|1
Albert J. Beveridge Award|1
"Nebula Award Nominee for Best Novella for ""Forgiveness Day"""|1
"Locus Award Nominee for Best Novella for ""Anasazi"""|1
Canadian Historical Association Clio Prize|1
National Book Critics Circle Award Nominee for Biography|1
Boston Globe-Horn Book Award for Fiction and Poetry|1
"Agatha Award for Best Short Story for ""Too Much To Bare"" by Joan Hess"|1
RITA Award by Romance Writers of America for Best Romance of 1989|1
Prémio Vergílio Ferreira|1
Arthur Ross Book Award for Silver Medal|1
South Lanarkshire Award|1
Kate Tufts Discovery Award|1
Vondel Prize Nominee for Susan Massotty|1
Obie for Best New American Play|1
Lambda Literary Award for Lesbian Debut Fiction|1
Los Angeles Times Book Prize|1
Noma Literary Prize 野間文芸賞|1
Prémio Clube Literário do Porto|1
Harvey Awards for Best Graphic Album|1
"Locus Award for Best Novelette for ""Taklamakan"""|1
P2-lytternes romanpris Nominee|1
Locus Award for Best Art Book|1
"Nebula Award for Best Novelette for ""San Diego Lightfoot Sue"""|1
BTBA Best Translated Book Award Nominee for Fiction longlist|1
Governor General's Literary Awards / Prix littéraires du Gouverneur général for Children’s Literature — Text|1
Carter G. Woodson Award|1
Prix des libraires du Québec for Lauréats québécois|1
"Hugo Award for Best Novelette for ""The Bicentennial Man"""|1
RITA Award by Romance Writers of America Nominee for Traditional Romance|1
Friends of American Writers Award|1
Grand Prix des lectrices de Elle Québec|1
"Locus Award for Best Novelette for ""Adrift Just Off the Islets of Langerhans: Latitude 38° 54' N"|1
Schlegel-Tieck Prize for Ian Crockatt|1
Children's Book Council of Australia Award for Book of the Year|1
Edgar Award Nominee for Best Juvenile|1
"Hugo Award Nominee for Best Novelette for ""San Diego Lightfoot Sue"""|1
BCCB Blue Ribbon Picture Book|1
Macavity Award for Best Critical/Biographical|1
Stockton Libraries Award|1
1997 awards)|1
Hunden som sprang mot en stjärna|1
Will Eisner Comic Industry Awards Nominee for Best Penciller/Inker or Penciller/Inker Team|1
Anisfield-Wolf Book Award for Fiction|1
Analog Award Nominee for Best Serial Novel or Novella|1
Sankei Children's Publishing Culture Award|1
New York City Book Award for Children's Book|1
Stockport Schools' Book Award|1
National Book Award Finalist for Contemporary Thought|1
for Absolute edition)|1
Premio Nazionale Letterario Pisa|1
"Locus Award for Best Novelette for ""Bloodchild"""|1
APSA Benjamin E. Lippincott Award|1
Sapphire Award winner|1
Children's Book Council of Australia Award for Book of the Year: Older Readers - Joint Winner|1
Stonewall Book Award for Non-Fiction|1
Best Coloring|1
Best Painter|1
New York City Book Award for Journalism|1
Prêmio Jabuti for Ilustração|1
com Tiago Veiga - Uma Biografia|1
P2-lytternes romanpris|1
"World Fantasy Award for Best Short Fiction for ""The Specialist's Hat"""|1
Philip Taft Labor History Book Award|1
IRA Children’s and Young Adult’s Book Award for Younger Reader Category|1
Kurt Maschler Award|1
Favorite Books by Romance Writers of America for Favorite Books of 2002|1
"Theodore Sturgeon Memorial Award for ""Story of Your Life"""|1
Jeannette Fair Award|1
Nevada Young Readers' Award|1
RITA Award by Romance Writers of America for Best Romantic Suspense|1
Premio Bagutta|1
Jefferson Davis Award|1
PEN Center USA Literary Award for Research Nonfiction|1
Red Adept Select|1
Salón Internacional del Cómic de Barcelona for Premio del público a la mejor obra extranjera|1
James Laughlin Award|1
Ditmar Award for Winner|1
The Rooster -- The Morning News Tournament of Books|1
"Analog Award Nominee for Best Short Story for ""View from a Height"""|1
Warwick Prize for Writing Nominee for Shortlist|1
John Florio Prize for Joseph Farrell|1
"Theodore Sturgeon Memorial Award Nominee for ""The Story So Far"""|1
Locus Award for Science Fiction Novel|1
Angelus Nominee for Shortlist|1
"Starry Night"" by Marianne Willman)"|1
California Book Award for Novel|1
The Irish Times Aer Lingus Literary Award|1
Peninsular Chapter RWA|1
Will Eisner Comic Industry Awards for Best Limited Series|1
Governor General's Literary Awards / Prix littéraires du Gouverneur général for Juvenile|1
Futuristic and Paranormal Special Interest Chapter of RWA for Best Dark Paranormal|1
Bram Stoker Award Nominee for Best Illustrated Narrative|1
HOMer Award Nominee for First Novel|1
Albertine Prize Nominee for Shortlist|1
Katholischer Kinder- und Jugendbuchpreis|1
Wilhelm-Hauff-Preis|1
Lambda Literary Award for Gay Men's Science Fiction/Fantasy|1
"Seiun Award 星雲賞 for Best Translated Short Story for ""Story of Your Life"""|1
"Analog Award Nominee for Best Serial Novel or Novella for ""Anasazi"""|1
Gordon Montador Award|1
