|0
Prix du Festival d'Angoulême Nominee for Alph-art du meilleur scenario|2
Susanne K. Langer Award for Outstanding Scholarship in the Ecology of Symbolic Form|2
National Book Award Finalist for First Work of Fiction|2
Futuristic and Paranormal Special Interest Chapter of RWA|2
Prix RTL grand public|2
|2
Massachusetts Book Award for Fiction|2
Lambda Literary Award for Gay Men's Nonfiction|2
Pulitzer Prize Nominee for History|2
Ditmar Award Nominee for Short Fiction|2
Minnesota Book Award for Mystery|2
The Children's Book Award from the Vienna House of Literature|2
National Book Award for Children's Picture Books|2
Mountains and Plains Booksellers Association Regional Book Award for Best Novel|2
Mitten Award Nominee for Honor Book|2
da antiga Prefeitura do Distrito Federal|2
William Saroyan International Prize for Writing for Fiction|2
McNally Robinson Book of the Year Award|2
National Book Award for Children's Fiction|2
Philip K. Dick Award for Special Citation|2
American Bar Association Silver Gavel Award for Books|2
New York Drama Critics' Circle Award for Best  Play|2
Kiriyama Prize|2
Gumshoe Award Nominee for Best Mystery|2
National Book Council Banjo Award for Non-Fiction|2
Seiun Award 星雲賞 for Best Nonfiction|2
Boardman Tasker Prize for Mountain Literature|2
Lambda Literary Award Nominee for Lesbian Fiction|2
Prix des Libraires|2
Tähtifantasia Award|2
Sydney Taylor Book Award|2
Prêmio Jabuti for Romance|2
BMO Winterset Award|2
Jewish Quarterly-Wingate Prize|2
Tidningen Vi:s litteraturpris|2
Peter Pan Award|2
Prix France-Liban de l'ADELF|2
Will Eisner Comic Industry Awards for Best Publication Design|2
"da Câmara Brasileira do Livro
...less"|2
Κρατικό Βραβείο Λογοτεχνικής Μετάφρασης for Μετάφραση Έργου Ξένης Λογοτεχνίας στην Ελληνική Γλώσσα|2
"Analog Award Nominee for Best Novella/Novelette for ""Gold"""|2
Seiun Award 星雲賞 Nominee for Best Translated Novel|2
Prêmio Carmem Dolores Barbosa|2
Locus Award for Best Art of Illustrated Book|2
Will Eisner Comic Industry Awards for Best Serialized Story|2
Nebula Award Nominee for Best Short story|2
Bremer Literaturpreis|2
Shaughnessy Cohen Prize for Political Writing|2
PEN Translation Prize for Margaret Jull Costa|2
Prix européen de l’essai Charles Veillon|2
Soaring Eagle Book Award for 7-9|2
Pura Belpré Award for Narrative|2
American Revolution Round Table Award|2
Boekenleeuw|2
Askew's Children's Book Award|2
Premio Rapallo|2
Aurealis Award for Fantasy Novel and Young Adult Novel|2
National Book Award Finalist for Autobiography/BiographyHardcover|2
Texas Bluebonnet Award Nominee|2
Minnesota Book Award for Young People’s Fiction|2
Vlag en Wimpel Penseeljury|2
NCTE Orbis Pictus Award|2
Nestlé Smarties Book Prize for 9–11 Years|2
National Book Award Finalist for Mystery|2
Barry Award for Best Paperback Original|2
Premi Ciutat de Barcelona|2
Prêmio Paula Brito|2
Los Angeles Times Book Prize for Best First Mystery Novel|2
Spur Award for Best Nonfiction Historical|2
Helen and Kurt Wolff Translator's Prize for Anthea Bell|2
Harvey Awards Nominee for Best Graphic Album of Previously Published Material|2
National Book Award for Poetry|2
Oregon Book Award for Nonfiction|2
Mark Twain Award|2
Premio San Clemente for Novela Galega|2
Best Writer/Artist|2
Tanizaki Prize 谷崎潤一郎賞|2
Audie Award for Best Unabridged Fiction|2
Sahitya Akademi Award|2
Audie Award for Biography/Memoir|2
Rocky Mountain Book Award|2
Kiriyama Prize for Nonfiction|2
Drama Desk Award for Outstanding New Play|2
Kate Greenaway Medal|2
Nebula Award Nominee for Best Novelette|2
Minnesota Book Award for Novel & Short Story|2
SCBWI Golden Kite Award for Fiction|2
Koret Jewish Book Award for Biography|2
Puddly Award for Memoir|2
Schlegel-Tieck Prize Nominee for Patrick Bridgwater|2
Locus Award Nominee for Best Short Story|2
Orange Prize Nominee for Longlist|2
"Prêmio Luísa Cláudia de Sousa
...more
do PEN Clube do Brasil"|2
BTBA Best Translated Book Award Nominee for Fiction Longlist|2
Missouri Gateway Readers Award for Young Adult|2
Prix du Festival d'Angoulême for Alfred du meilleur album étranger|2
Best Artist|2
Best Limited Series|2
Spur Award for Best Juvenile|2
Stonewall Book Award Nominee for Non-Fiction|2
Dirk Martensprijs|2
Listen-Up Award|2
HOLT Medallion by Virginia Romance Writers Nominee for Mainstream Single-Title|2
Locus Award Nominee for Best Short Fiction|2
Samuel Johnson Prize for Non-Fiction|2
Sir Peter Kent Conservation Book Prize|2
Sách Hay|2
Massachusetts Book Award Nominee for Young Adult Literature|2
Great Lakes Book Award Nominee for Nonfiction Shortlist|2
Commonwealth Writers' Prize for Best Book|2
Will Eisner Comic Industry Awards for Best Publication for Teens/Tweens|2
Ambassador Book Award for Autobiography|2
Spur Award for Best Nonfiction|2
Autobiography or Literary Study|2
Prix Aurora Award for Best Long-Form Work in English|2
Whitbread Award for First Novel and Book of the Year|2
CWA Gold Dagger Award for Non Fiction|2
Ned Kelly Award Nominee for Best Novel|2
John Florio Prize for Martin McLaughlin|2
"Premio Ignotus Nominee for Mejor cuento extranjero for ""Gold"""|2
RITA Award by Romance Writers of America Nominee for First Book|2
Ruth Hadden Memorial Award|2
Prix Méditerranée|2
Premi Protagonista Jove Nominee for Categoria 13-14 anys|2
J. Anthony Lukas Book Prize|2
RBC Taylor Prize|2
William Saroyan International Prize for Writing Nominee for Fiction|2
HOLT Medallion by Virginia Romance Writers|2
Premio de la Crítica de narrativa gallega / Premio da Crítica de narrativa galega|2
Ezra Jack Keats Book Award for New Writer|2
Grand Prix de l'Imaginaire for Traduction|2
Commonwealth Writers' Prize for South East Asia and Pacific|2
Beehive Book Award for Young Adult Fiction Book|2
Premio Grinzane Cavour Nominee for Narrativa Italiana|2
"the Lamps of His Mouth"""|2
Wirral Paperback of the Year|2
Hugo Award Nominee for Best Nonfiction Book|2
Beehive Book Award for Young Adult Book|2
SF Chronicle Award Nominee for Best SF Novel|2
O. Henry Award for 'Lily'|2
Commonwealth Writers' Prize Nominee for Best Book in  South Asia and Europe|2
Locus Award Nominee for Best First Novel and Best Horror Novel|2
The Louis J. Battan Author's Award for Adult|2
Geffen Award for Best Translated YA Book|2
Prêmio Jabuti for Produção editorial|2
Evening Standard Award for Best Play of the Year|2
Fraunces Tavern Museum Book Award|2
California Book Award for First Novel|2
Society of Midland Authors Award for Nonfiction|2
New South Wales Premier's Literary Award for Douglas Stewart Prize for Non-Fiction|2
Northern California Book Awards|2
Children’s Peace Literature Award|2
HOLT Medallion by Virginia Romance Writers Nominee for Traditional|2
Goethe Prize|2
Corine Internationaler Buchpreis for Weltbild Leserpreis|2
برنده جایزه آریلیس|2
Goodreads Choice Award Nominee for Fiction|2
CWA Ellis Peters Award Nominee for Historical Crime Fiction|2
جایزه ادبی مهرگان for مهرگان علم|2
Book Sense Book of the Year Award Nominee|2
Australian Multicultural Children's BOTY Award|2
Lambda Literary Award Nominee for Science Fiction/Fantasy|2
Hugo Award for Best Short Story for “Kirinyaga”|2
Best New Series|2
Nebula Award for Best Novelette|2
PEN/Martha Albrand Award for the Art of the Memoir|2
Buckeye Children's Book Award for 3-5|2
British Columbia National Award for Canadian Non-Fiction Nominee|1
HOLT Medallion by Virginia Romance Writers for Paranormal|1
Audie Award for Poetry|1
Kentucky Bluegrass Award for 3-5|1
Christy Award Nominee for International Historical|1
Will Eisner Comic Industry Awards Nominee for Best Reality-Based Work|1
Arkansas Diamond Primary Book Award|1
One Book One San Diego for Children's Companion Title|1
Mythopoeic Fantasy Award for Children’s Literature|1
Retailer's Choice Award for Inspirational Fiction Novel|1
Children's Book Council of Australia Award Nominee for Picture Book of the Year - Highly Commended|1
"Hugo Award Nominee for Best Novella for ""Seventy-Two Letters"""|1
O. Henry Award for 'What You Pawn I Will Redeem'|1
Desert Rose Golden Quill Award for Best First Book|1
RITA Award by Romance Writers of America Nominee for First Book & Nominee for Paranormal Romance|1
Premio de traducción literaria Valle Inclán for Nick Caistor|1
Prijs van de Vlaamse Gemeenschap voor Proza|1
Gumshoe Award Nominee for Best Thriller|1
James Tait Black Memorial Prize|1
"Retro Hugo Award for Best Novella for ""The Man Who Sold the Moon"""|1
Victorian Premier's Literary Award for Nettie Palmer Prize for Non-Fiction|1
Prix Roger-Nimier|1
Le Blanc Award for Melhor Romance Estrangeiro de Fantasia|1
"Locus Award Nominee for Best Anthology and Best Novella for ""Seventy-Two Letters"""|1
Nita B. Kibble Literary Award|1
"HOMer Award Nominee for Novelette for ""Another Story"""|1
"HOMer Award Nominee for Best Novella for ""Story of Your Life"""|1
Premio Alberto Moravia|1
Premio Grinzane Cavour for Narrativa Italiana|1
Nynorsk litteraturpris|1
Heart & Scroll Madcap Award|1
منحة غونكور للرواية الأولى|1
HOLT Medallion by Virginia Romance Writers Nominee for Paranormal|1
Prix du Festival d'Angoulême for Prix du premier album|1
Soeurette Diehl Fraser Award for Best Translation|1
Golden Medallion by Romance Writers of America Nominee for Contemporary Romance over 80|1
Prix Aurora Award for Meilleur livre en français|1
The ESFS Award for Novel|1
Brooker Award|1
British Science Fiction Association Award for Special Award|1
New York City Book Award for Biography|1
O. Henry Award for 'The Pugilist at Rest'|1
O. Henry Award|1
"Theodore Sturgeon Memorial Award for ""Forgiveness Day"""|1
Prémio Pessoa|1
Finlandia Prize|1
Newfoundland and Labrador Book Awards for Fiction|1
Hilary Weston Writers' Trust Prize for Nonfiction|1
Whitbread Award for Biography|1
Locus Award Nominee for Best Novella|1
Iowa Short Fiction Award|1
"James Tiptree Jr. Award Nominee for Longlist for ""Forgiveness Day"""|1
Locus Award for Best First Novel and Nominee for Best SF Novel|1
"Theodore Sturgeon Memorial Award Nominee for ""Another Story or A Fisherman of the Inland Sea"""|1
The Hughes & Hughes Literary Award|1
Kentucky Bluegrass Award|1
"Locus Award Nominee for Best Short Story for ""The Crystal Spheres"""|1
Locus Award Nominee for Fantasy Novel|1
Golden Duck Award Nominee|1
Nestlé Smarties Book Prize for 9 – 11 Years|1
Rudolf Koivu -palkinto|1
Anni Swan -mitali|1
Children's Book Council of Australia Award for Picture Book of the Year - Joint Winner|1
Walt Whitman Award|1
Mountains and Plains Booksellers Association Regional Book Award|1
Międzynarodowa Nagroda Literacka im. Janusza Korczaka|1
Ruth and Sylvia Schwartz Children's Book Award for Children's Picture Book|1
Lambda Literary Award for Best Lesbian Fiction|1
Daphne du Maurier Award of Excellence|1
National Book Award Finalist for Arts and Letters|1
Buckeye Children's Book Award for 4-8|1
RITA Award by Romance Writers of America for Best Contemporary Single Title & nominee for Best Romance of 1998|1
Deutscher Jugendliteraturpreis for Sachbuch|1
Lambda Literary Award for Editor's Choice|1
"Nebula Award Nominee for Best Novelette for ""Burning Chrome"""|1
Ruth Lilly Poetry Prize|1
Will Eisner Comic Industry Awards for Best Graphic Album|1
Georgia Children's Book Award|1
John Simmons Short Fiction Award|1
Library of Congress Children's Book Award|1
Boston Globe-Horn Book Award for Fiction Honor Book|1
Deutscher Jugendliteraturpreis|1
本屋大賞 Nominee for Translated Fiction|1
SF Chronicle Award Nominee for Best Novella|1
"Analog Award Nominee for Best Novella/Novelette for ""The Locusts"""|1
Le Blanc Award Nominee for Melhor Antologia Estrangeira de Fantasia|1
Noma Literary Prize 野間文芸賞 for New Face Prize|1
Best Continuing or Limited Series|1
Harvey Awards for Best US Edition of Foreign Material|1
Winter Rose Award of Excellence|1
"Hugo Award Nominee for Best Novelette for ""Guardians"""|1
Eric Hoffer Book Award Nominee for General Fiction|1
& Best Cartoonist|1
Locus Award Nominee for All-Time Best SF Novel|1
National Book Award for Science Fiction|1
"World Fantasy Award for Best Anthology/Collection and Nominee for Best Short Fiction for ""Children of the Kingdom"""|1
Caughey Western History Prize|1
J. A. Hollon palkinto|1
Blue Hen Book Award|1
Premio Torrente Ballester|1
SF Chronicle Award for Best Novelette|1
"Nebula Award Nominee for Best Short Story for ""Shatterday"""|1
Pushcart Prize|1
Daphne du Maurier Award for Suspense|1
Anthony Award for Best Critical Work|1
John K. Fairbank Prize|1
Judy Grahn Award Nominee|1
Booker Prize for The Lost Man Booker Prize|1
South Florida Sun-Sentinel for Best Mysteries|1
Premi Protagonista Jove Nominee for Categoria 16-17 anys|1
Historical or Journalistic Presentation & Best Writer|1
Deutscher Krimi Preis for 2. Platz National|1
Grand Prix de l'Imaginaire|1
"Nebula Award for Best Novella for ""Story of Your Life"""|1
The E.H. McCormick Award Best First Book|1
Writers’ League of Texas Teddy Award|1
Christianity Today Book Award|1
Ambassador Book Award for American Arts & Letters|1
Premio Bancarelino|1
National Book Award for Biography|1
American Institute of Physics Science Writing Award|1
Edgar Award Nominee for Best Young Adult|1
گنکو|1
Sunshine State Young Readers Award for Grades 3-5|1
Akateemisen kirjakaupan myydyin esikoisteos|1
Foreword INDIES Book of the Year Award Nominee for Fiction|1
Lambda Literary Award for Lesbian Mystery|1
Icelandic Literary Prize Nominee for Fiction|1
Human Rights Literature and Other Writing Award|1
"Nebula Award Nominee for Best Short Story for ""None So Blind"""|1
O. Henry Award for 'Puttermesser Paired'|1
"Nebula Award Nominee for Best Short Story for ""Dori Bangs"""|1
Premi Ramon Llull|1
"Balrog Award Nominee for Best Short Fiction for ""Children of the Kingdom"""|1
Pearl Award Winner|1
Favorite Books by Romance Writers of America Nominee for Favorite Books of 2001|1
New Mexico Young Readers Award|1
Scottish Arts Council Book of the Year Award|1
Harvey Awards for Best Writer|1
Elsa Beskow-plaketten|1
Boston Globe-Horn Book Award for Picture Book|1
James A. Rawley Prize|1
"Balrog Award Nominee for Best Short Fiction for ""Grail"""|1
Prix de la critique|1
Национална награда „Христо Г. Данов“ for Преводна художествена литература|1
Young Readers' Choice Award Nominee|1
Premio Ignotus Nominee for 	Mejor novela extranjera|1
OKRWA National Readers Choice Award for Single Title Contemporary|1
ACFW Carol Award|1
"Locus Award Nominee for Best Novelette for ""San Diego Lightfoot Sue"""|1
Avery O. Craven Award|1
Prix du Festival d'Angoulême for Alph-art du meilleur album|1
Premio Ignotus for Mejor antología|1
Whitbread Award Nominee for Children's Book|1
EU Descartes Prize for science communication|1
Best Colorist|1
"Locus Award Nominee for Best Anthology and Best  Short Story for ""The Story So Far"""|1
Locus Award Nominee for Best Young Adult Book|1
HOLT Medallion by Virginia Romance Writers for Short Historical|1
Will Eisner Comic Industry Awards for Best Graphic Album–New|1
Helen and Kurt Wolff Translator's Prize for Krishna Winston|1
RBL Romantica Hughie Award for Favorite Hero|1
Agatha Award for Best Childrens Young Adult|1
Best Continuing Series|1
Alan Paton Award|1
Land of Enchantment Book Award for Young Adult|1
"Hugo Award Nominee for Best Novella for ""Story of Your Life"""|1
Prix Millepages Award for Foreign Fiction|1
Lambda Literary Award for AIDS & for Nonfiction|1
Kiriyama Prize Nominee|1
Book Sense Book of the Year Award for Children's Illustrated|1
Helen and Kurt Wolff Translator's Prize for Breon Mitchell|1
"Hugo Award Nominee for Best Novelette for ""The Locusts"""|1
National Book Award for First Novel|1
Gouden Griffel|1
"Hugo Award for Best Novelette for ""Fire Watch"""|1
Society of Midland Authors Award for Biography|1
Lambda Literary Award Nominee|1
Icelandic Literary Prize for Fiction|1
Phi Beta Kappa Award in Science|1
RITA Award by Romance Writers of America Nominee for Short Contemporary Romance|1
Governor General's Literary Awards / Prix littéraires du Gouverneur général for Nonfiction|1
Hackmatack Children's Choice Award for English Fiction|1
Julia Cherry Spruill Prize|1
WH Smith Teen Choice Award|1
RIO Award of Excellence by Reviewers International Organization for Favorite Paranormal|1
"SF Chronicle Award for Short Story for ""Dori Bangs"""|1
Rosenthal Family Foundation Award for Fiction|1
Macavity Award for Best Nonfiction|1
Colorado Young Readers Award|1
John Florio Prize for Stuart Woolf|1
Openbook好書獎 for 年度好書．翻譯書|1
Human Rights Award for Children's Book|1
"Nebula Award Nominee for Best Novelette for ""Mikal's Songbird"""|1
"Theodore Sturgeon Memorial Award Nominee for ""Heroics"""|1
"Nebula Award for Best Novelette for ""The Doors of His Face"|1
Pulitzer Prize for Special Citation|1
"Agatha Award for Best Short Story for ""The Dog Who Remembered Too Much"" by Elizabeth Daniels Squire"|1
Idaho Book of the Year Award Nominee for|1
"James Tiptree Jr. Award Nominee for ""Story of Your Life"""|1
BTBA Best Translated Book Award for Fiction|1
Guinness Peat Aviation Award|1
National Book Award Finalist for Poetry|1
Fletcher Pratt Award|1
"SF Chronicle Award for Novelette for ""Fire Watch"""|1
George Washington Book Prize|1
IRA Children’s and Young Adult’s Book Award for Young Adult–Fiction|1
National Biography Award|1
HOLT Medallion by Virginia Romance Writers for Long Historical|1
"Locus Award for Best Collection and Best Short Story for ""None So Blind"""|1
Prix René Fallet|1
Eugène Marais-prys|1
Prijs van de Nederlandse Kinderjury for 6-9 jaar|1
"Balrog Award Nominee for Best Short Fiction for ""Jeffty Is Five"""|1
Grand prix du roman noir|1
Children's Book Council of Australia Award Nominee for Picture Books|1
Lambda Literary Award for Gay Men's Debut Fiction|1
Henry Kriesel Award for Best First Book|1
Oklahoma Sequoyah Award for Children's|1
Jewish Quarterly-Wingate Prize for Nonfiction|1
"Analog Award Nominee for Best Novella/Novelette for ""Guardians"""|1
Macavity Award for Best Novel|1
Locus Award Nominee for Best Novella and Best SF Novel|1
BP Natural World Book Award|1
"Nebula Award Nominee for Best Novelette for ""Rockabye Baby"""|1
Kiitos kirjasta -mitali|1
Purple Dragonfly Book Awards for Historical Fiction|1
Wellcome Book Prize Nominee for Shortlist|1
Mr. Christie's Book Award|1
National Book Award Finalist for Biography and Autobiography|1
Arizona YA Book Award Nominee|1
"Hugo Award for Best Novelette for ""Taklamakan"""|1
Will Eisner Comic Industry Awards for Talent Deserving of Wider Recognition|1
San Francisco Book Festival Nominee for Photography/Art|1
New Mexico Land of Enchantment Award for Children's|1
IRA Children’s and Young Adult’s Book Award for Young Adult Category|1
"Nebula Award for Best Novelette for ""Louise's Ghost"""|1
Hackmatack Children's Choice Award for Fiction|1
Seiun Award 星雲賞 for Best Translated Novel|1
Augustpriset Nominee for Fiction|1
Pennsylvania Young Readers' Choice Award for Young Adults|1
Charles S. Sydnor Award|1
Premio Biblioteca Breve|1
Premio Viareggio Nominee for|1
"Locus Award Nominee for Best Novelette for ""Rockabye Baby"""|1
RITA Award by Romance Writers of America for Best Romantic Novella|1
"Locus Award Nominee for Best Anthology and Best Short Story for ""The Edge of the World"""|1
British Fantasy Award for Best Anthology|1
ECPA Christian Book Award for Fiction|1
Premio de traducción literaria Valle Inclán for Sonia Soto|1
"""Show 'Em All"""|1
HOLT Medallion by Virginia Romance Writers for Best First Book|1
HOLT Medallion by Virginia Romance Writers for Long Inspirational|1
Mythopoeic Fantasy Award Nominee for for Adult Literature|1
Nestlé Smarties Book Prize for 6 – 8 Years|1
Nestlé Smarties Book Prize for 0 – 5 Years & Overall|1
Médaille de l'Académie canadienne-française|1
Premi Sant Jordi|1
Dobbie Literary Award Nominee|1
Prix des Libraires algériens|1
Joan Kelly Memorial Prize in Women's History|1
Prix du Festival d'Angoulême for Prix de la critique|1
Science Book Prize Nominee|1
"Hugo Award Nominee for Best Novelette for ""The Winter Market"""|1
M-Net Literary Award|1
Wilderness Society's Environment Award for Children's Literature Nominee for Picture Book|1
DebutantenPrijs|1
Claudia Lewis Award|1
James Tiptree Jr. Award Nominee for Special Mention - 20th Anniversary Republication|1
Fraenkel Prize of the Wiener Library|1
Sveriges Radios Romanpris|1
Grand Prix de l'Imaginaire for prix spécial du jury|1
Prix Alain-Fournier|1
International Rubery Book Award|1
NSK Neustadt Prize for Children's Literature|1
Best Novel|1
Prix Tour-Apollo Award for Prix Apollo|1
Harvey Awards for Best Graphic Album of Original Work|1
"Asimov's Readers' Poll Award for Best Novella for ""Forgiveness Day"""|1
Will Eisner Comic Industry Awards for Best Single Issue|1
Davitt Award for Best Adult Novel|1
Best Single Issue or Story|1
"SF Chronicle Award for Short Story for ""None So Blind"""|1
Minnesota Book Award for Biography|1
Boston Globe-Horn Book Award for Non-Fiction|1
Gayle Wilson Award of Excellence for Inspirational Romance|1
Desert Rose Golden Quill Award|1
"Locus Award for Best Novelette for ""Guardians"""|1
Flicker Tale Children's Book Award Nominee for Juvenile|1
Desert Rose Golden Quill Award for Best Paranormal|1
William Saroyan International Prize for Writing for Nonfiction|1
"Hugo Award Nominee for Best Short Story for ""The Story So Far"""|1
Merle Curti Award|1
Gouden Strop|1
Theakston Old Peculier Crime Novel of the Year|1
Best Lettering|1
Ockham New Zealand Book Awards for Cultural Heritage|1
Booker Prize Nominee for The Lost Man Booker Prize|1
Prometheus Hall of Fame Award Nominee for Best Classic Libertarian SF Novel|1
Prix Broquette-Gonin de l'Académie Française for Littérature|1
Yale Series of Younger Poets Competition|1
The Booker of Bookers Prize|1
Booksellers' Best Award for Best Paranormal|1
Prix Aurora Award for Best Long Form|1
Children's Book Council of Australia Award for Picture Book of the Year|1
Hugo Award for Other Forms|1
Locus Award for Best Novelette|1
Royal Society Science Book Prize for Junior Prize|1
Prémio de Melhor Ficção Narrativa - Gala da Sociedade Portuguesa de Autores|1
Anthony Award Nominee for Best Short Story Collection|1
RITA Award by Romance Writers of America Nominee for Long Contemporary Series Romance|1
HOLT Medallion by Virginia Romance Writers for Short Inspirational|1
Prix Jan Michalski|1
"Hugo Award for Best Short Story for ""The Crystal Spheres"""|1
Best Finite Series|1
Science Fiction and Fantasy Translation Award Nominee for Long Form|1
Prémio Camões|1
Boston Globe-Horn Book Award Nominee for Fiction and Poetry|1
Nestlé Smarties Book Prize for 9-11 years|1
Balrog Award for Best Collection|1
RITA Award by Romance Writers of America Nominee for Futuristic/Fantasy/Paranormal Romance|1
Tom-Gallon Trust Award for 'The Egg Man'|1
"Analog Award Nominee for Best Short Story for ""The Man Who Was Heavily into Revenge"""|1
HOLT Medallion by Virginia Romance Writers for Historical|1
Prix Littéraire Européen - Madeleine Zepter|1
"Theodore Sturgeon Memorial Award Nominee for ""The Elizabeth Complex"""|1
Prometheus Award|1
OKRWA National Readers Choice Award|1
Ficção Científica ou Terror Publicada em Língua Portuguesa|1
"Theodore Sturgeon Memorial Award Nominee for ""Seventy-Two Letters"""|1
RITA Award by Romance Writers of America for Best Single Title Historical  & Nominee for Best Romance of the Year|1
French-American Foundation Translation Prize Nominee for Fiction|1
O. Henry Award for 'Errand'|1
Last Laugh Dagger|1
FHL Reader’s Choice Award|1
Βραβείο Λογοτεχνικής Μετάφρασης ΕΚΕΜΕΛ for Αγγλόφωνη Λογοτεχνία|1
Futuristic and Paranormal Special Interest Chapter of RWA for Fantasy|1
Alfred-Döblin-Preis for Förderpreis|1
Judy Grahn Award for Lesbian Nonfiction|1
"Balrog Award Nominee for Best Short Fiction for ""Fire Watch"""|1
"SF Chronicle Award Nominee for Best Novelette for ""The Winter Market"""|1
Olive Schreiner Prize for Prose|1
Anthony Award Nominee for Best Critical/Biographical|1
Seiun Award 星雲賞 for Best Translated Long Form|1
RBL Romantica Hughie Award for Best Anthology|1
Marsh Biography Award|1
HOLT Medallion by Virginia Romance Writers for Mainstream/Single Title|1
Ockham New Zealand Book Awards for Best First Book|1
Aurealis Award Nominee for Best Novel|1
National Critics' Prize of Catalonia|1
RBL Romantica Hughie Award for Best Cover|1
OKRWA National Readers Choice Award for Short Contemporary|1
Los Angeles Times Book Prize Nominee for Art Seidenbaum Award for First Fiction|1
Hugo Award Nominee for Best Short Story|1
Premio Aztlán Literary Prize|1
Grand Prix de l'Imaginaire for roman étranger traduit|1
Hugo Award for Best Related Work|1
Minnesota Book Award for Genres|1
SCBWI Golden Kite Award for Picture Book Illustration|1
Tage der deutschsprachigen Literatur for Ernst-Willner-Preis|1
Schlegel-Tieck Prize for John Brownjohn|1
Prix Jules Verne|1
Premio Sor Juana Inés de la Cruz|1
Hugo Award for Best Short Story for “None So Blind”|1
National Book Critics Circle Award for Poetry|1
Locus Award for Best Non-Fiction/Art|1
Lambda Literary Award for Gay Fiction|1
Pulitzer Prize for Nonfiction|1
James Beard Foundation Book Award Nominee for Writing on Food|1
Helen and Kurt Wolff Translator's Prize for John Brownjohn|1
Evening Standard Award for Best Comedy|1
Thom Gunn Award for Gay Poetry|1
Will Eisner Comic Industry Awards for Best Graphic Album–Reprint|1
Lambda Literary Award Nominee for Lesbian Mystery|1
Premio Alassio Centolibri - Un autore per l'Europa|1
James Russell Lowell Prize|1
Audie Award for Literary Fiction|1
Jane Grigson Award|1
